{
  "enabled": true,
  "hook": "goal.before_complete",
  "runner": {
    "command": "goalreviewhelper",
    "workdir": ".",
    "args": []
  },
  "allowed_inputs": [
    "goal_state",
    "work_summary",
    "test_results",
    "blockers",
    "recent_trace"
  ],
  "allowed_actions": [
    "goal.approve_complete",
    "goal.reject_complete",
    "goal.request_continue",
    "diagnosis.note.create",
    "ledger.artifact.create"
  ],
  "max_continue_attempts": 3,
  "cooldown_seconds": 60
}
